{
  "schema_version": "1.0",
  "run_id": "release-2026-0001",
  "owner": "authorized-operations-owner",
  "issued_at": "2026-01-01T00:00:00Z",
  "expires_at": "2026-01-01T02:00:00Z",
  "environment": "production",
  "artifact_sha256": "0000000000000000000000000000000000000000000000000000000000000000",
  "trusted_executables": [
    {"path": "C:/absolute/path/release-tool.exe", "sha256": "0000000000000000000000000000000000000000000000000000000000000000"}
  ],
  "environment_bindings": {
    "inherit": [],
    "required_sha256": {}
  },
  "allowed_actions": ["canary_deploy", "health_check", "observe", "deploy", "rollback"],
  "allowed_paths": ["C:/absolute/scoped/release-directory"],
  "allowed_commands": [
    ["C:/absolute/path/release-tool.exe", "deploy", "--artifact", "artifact.zip"],
    ["C:/absolute/path/release-tool.exe", "health", "--revision", "exact-revision"],
    ["C:/absolute/path/release-tool.exe", "rollback", "--revision", "previous-revision"]
  ],
  "limits": {"max_duration_minutes": 120, "max_attempts_per_step": 2, "max_changed_files": 0, "max_cost_usd": 0},
  "health_checks": ["post-deploy-health"],
  "rollback": {"action": ["C:/absolute/path/release-tool.exe", "rollback", "--revision", "previous-revision"], "deadline_minutes": 30},
  "approval": {"type": "explicit-preauthorization", "evidence_ref": "approved-change-record"},
  "hard_stops": ["artifact mismatch", "authorization mismatch", "failed health gate", "retry budget exhausted"]
}
